{
  "formatVersion": 2,
  "id": "app.scriptwidget.example.selected-contacts",
  "name": "People Close By",
  "version": "1.0.0",
  "runtimeVersion": "1.0",
  "minimumRuntimeVersion": "1.6",
  "entry": "main.jsx",
  "supportedFamilies": [
    "systemMedium",
    "systemLarge"
  ],
  "permissions": [
    "contacts"
  ],
  "networkDomains": [],
  "license": "Apache-2.0"
}
